{
  "schema_version": "openclaw.task-runner.summary.v1alpha1",
  "task_id": "task-intake-readonly",
  "run_id": "run-20260322-intake-readonly",
  "status": "completed_with_followup",
  "summary": {
    "goal": "Prepare a repo-side readonly intake path for reviewed broker dry-runs.",
    "outcome": "The runner produced only readonly broker-aligned follow-up so main can validate evidence and boundary carry-forward without any host mutation.",
    "host_change_needed": true
  },
  "repo_changes": {
    "changed_files": [
      "schemas/broker-ready-request.schema.json",
      "schemas/task-runner-intake-report.schema.json",
      "scripts/build-broker-ready-request.py"
    ],
    "diff_path": "outputs/diff.patch"
  },
  "validation_results": [
    {
      "name": "task-runner contract validation",
      "status": "passed",
      "artifact_path": "outputs/task-runner-contract-validation.log"
    }
  ],
  "outputs": {
    "summary_md": "outputs/summary.md",
    "summary_json": "outputs/summary.json",
    "diff_patch": "outputs/diff.patch",
    "host_change_request": "outputs/host-change-request.json",
    "logs": [
      "outputs/task-runner-contract-validation.log"
    ]
  },
  "requires_operator_approval": false,
  "forbidden_actions": [
    "direct_docker_control",
    "direct_host_shell",
    "direct_openclaw_config_edit",
    "direct_secret_handling",
    "direct_snapshot_manipulation",
    "direct_systemd_control",
    "direct_vault_manipulation",
    "unstructured_operator_commands",
    "user_level_gateway_start"
  ],
  "evidence_refs": [
    {
      "id": "design-v3",
      "kind": "design_doc",
      "path": "docs/design-v3.md",
      "description": "Authoritative design for the future task-runner to main to broker flow."
    },
    {
      "id": "current-boundary",
      "kind": "boundary_doc",
      "path": "docs/current-boundary.md",
      "description": "Confirms the current slice remains repo-side and Phase 3 is not live-enabled."
    },
    {
      "id": "host-sop",
      "kind": "sop_doc",
      "path": "docs/host-sop.md",
      "description": "Authority for host facts, readonly boundaries, and forbidden operations."
    }
  ],
  "next_handoff": {
    "consumer": "main",
    "action": "review_host_change_request",
    "host_change_request_path": "outputs/host-change-request.json"
  }
}
